{
  "$schema": "https://json-schema.org/draft/2020-12/schema",
  "$id": "https://j7an.github.io/cross-agent-reviews/schema/v1/state.json",
  "title": "State",
  "type": "object",
  "additionalProperties": false,
  "required": ["schema_version", "slug"],
  "anyOf": [
    {"required": ["spec"]},
    {"required": ["plan"]}
  ],
  "properties": {
    "schema_version": {"const": 1},
    "slug": {"type": "string", "pattern": "^[A-Za-z0-9._-]+$", "minLength": 1},
    "spec": {"$ref": "#/$defs/artifact_block"},
    "plan": {"$ref": "#/$defs/plan_artifact_block"}
  },
  "$defs": {
    "stage": {
      "type": "string",
      "enum": [
        "round_1a_pending",
        "round_1b_pending",
        "round_2a_pending",
        "round_2b_pending",
        "round_3a_pending",
        "round_3b_pending",
        "round_3c_pending",
        "ready_for_implementation"
      ]
    },
    "completed_round": {"type": "string", "enum": ["1a", "1b", "2a", "2b", "3a", "3b", "3c"]},
    "iso8601_utc": {"type": "string", "pattern": "^\\d{4}-\\d{2}-\\d{2}T\\d{2}:\\d{2}:\\d{2}Z$"},
    "content_hash": {"type": "string", "pattern": "^sha256:[0-9a-f]{64}$"},
    "resolution_reason": {
      "type": "object",
      "additionalProperties": false,
      "required": ["rule_id", "selected_profile"],
      "properties": {
        "rule_id": {"type": "string"},
        "competing_rules": {"type": "array", "items": {"type": "string"}},
        "selected_profile": {"type": "string", "enum": ["patch", "feature", "greenfield"]}
      }
    },
    "fired_rule": {
      "type": "object",
      "additionalProperties": false,
      "required": ["rule_id", "kind", "matched_signals"],
      "properties": {
        "rule_id": {"type": "string"},
        "kind": {"type": "string", "enum": ["profile", "mode"]},
        "votes_profile": {"type": "string", "enum": ["patch", "feature", "greenfield"]},
        "matched_signals": {"type": "object"}
      },
      "if": {"properties": {"kind": {"const": "profile"}}},
      "then": {"required": ["votes_profile"]}
    },
    "suggestion_evidence": {
      "type": "object",
      "additionalProperties": false,
      "required": [
        "ruleset_version", "artifact_type", "artifact_content_hash", "resolution",
        "suggested_review_profile", "suggested_mode", "fast_eligible",
        "fired_rules", "resolution_reason", "signals"
      ],
      "properties": {
        "ruleset_version": {"type": "integer", "minimum": 1},
        "artifact_type": {"type": "string", "enum": ["spec", "plan"]},
        "artifact_content_hash": {"$ref": "#/$defs/content_hash"},
        "resolution": {"type": "string", "enum": ["single", "agreement", "conflict", "insufficient_evidence"]},
        "suggested_review_profile": {"type": "string", "enum": ["patch", "feature", "greenfield"]},
        "suggested_mode": {"type": "string", "enum": ["thorough", "fast"]},
        "fast_eligible": {"type": "boolean"},
        "fired_rules": {"type": "array", "items": {"$ref": "#/$defs/fired_rule"}},
        "resolution_reason": {"$ref": "#/$defs/resolution_reason"},
        "signals": {"type": "object"}
      }
    },
    "artifact_block": {
      "type": "object",
      "additionalProperties": false,
      "required": ["path", "content_hash", "current_stage", "completed_rounds", "started_at", "last_updated_at"],
      "properties": {
        "path": {"type": "string", "minLength": 1},
        "content_hash": {"$ref": "#/$defs/content_hash"},
        "current_stage": {"$ref": "#/$defs/stage"},
        "completed_rounds": {
          "type": "array",
          "items": {"$ref": "#/$defs/completed_round"},
          "uniqueItems": true
        },
        "started_at": {"$ref": "#/$defs/iso8601_utc"},
        "last_updated_at": {"$ref": "#/$defs/iso8601_utc"},
        "mode": {"type": "string", "enum": ["thorough", "fast"]},
        "review_profile": {"type": "string", "enum": ["patch", "feature", "greenfield"]},
        "suggested_review_profile": {"type": "string", "enum": ["patch", "feature", "greenfield"]},
        "suggested_mode": {"type": "string", "enum": ["thorough", "fast"]},
        "suggestion_evidence": {"$ref": "#/$defs/suggestion_evidence"}
      }
    },
    "plan_artifact_block": {
      "type": "object",
      "additionalProperties": false,
      "required": ["path", "content_hash", "current_stage", "completed_rounds", "started_at", "last_updated_at"],
      "properties": {
        "path": {"type": "string", "minLength": 1},
        "content_hash": {"$ref": "#/$defs/content_hash"},
        "spec_hash_at_start": {"$ref": "#/$defs/content_hash"},
        "current_stage": {"$ref": "#/$defs/stage"},
        "completed_rounds": {
          "type": "array",
          "items": {"$ref": "#/$defs/completed_round"},
          "uniqueItems": true
        },
        "started_at": {"$ref": "#/$defs/iso8601_utc"},
        "last_updated_at": {"$ref": "#/$defs/iso8601_utc"},
        "mode": {"type": "string", "enum": ["thorough", "fast"]},
        "review_profile": {"type": "string", "enum": ["patch", "feature", "greenfield"]},
        "suggested_review_profile": {"type": "string", "enum": ["patch", "feature", "greenfield"]},
        "suggested_mode": {"type": "string", "enum": ["thorough", "fast"]},
        "suggestion_evidence": {"$ref": "#/$defs/suggestion_evidence"}
      }
    }
  }
}
