{
  "schema_version": 1,
  "slug": "2026-05-07-issue-1",
  "spec": {
    "path": "docs/specs/2026-05-07-issue-1-design.md",
    "content_hash": "sha256:1111111111111111111111111111111111111111111111111111111111111111",
    "current_stage": "ready_for_implementation",
    "completed_rounds": ["1a", "1b", "2a", "2b", "3a", "3b"],
    "started_at": "2026-05-07T10:00:00Z",
    "last_updated_at": "2026-05-07T11:30:00Z"
  },
  "plan": {
    "path": "docs/plans/2026-05-07-issue-1-plan.md",
    "content_hash": "sha256:2222222222222222222222222222222222222222222222222222222222222222",
    "spec_hash_at_start": "sha256:1111111111111111111111111111111111111111111111111111111111111111",
    "current_stage": "round_2a_pending",
    "completed_rounds": ["1a", "1b"],
    "started_at": "2026-05-07T11:45:00Z",
    "last_updated_at": "2026-05-07T12:10:00Z"
  }
}
